<!ELEMENT menu (item+)>
<!ELEMENT item (name, price, qty, description)>
<!ELEMENT name (#PCDATA)>
<!ELEMENT price (#PCDATA)>
<!ELEMENT qty (#PCDATA)>
<!ELEMENT description (#PCDATA)>
